{
	"name": "Portfolio Starter",
	"description": "Pages for the portfolio starter — Home, Work, About, Contact, and a Getting Started reference page.",
	"version": "1.0.0",
	"objects": [
		{
			"collection": "builder-pages",
			"id": "home",
			"data": {
				"id": "home",
				"title": "Home",
				"route": "/",
				"template": "index",
				"draft": false,
				"nav": true,
				"data": {}
			}
		},
		{
			"collection": "builder-pages",
			"id": "work",
			"data": {
				"id": "work",
				"title": "Work",
				"route": "/work",
				"template": "work",
				"draft": false,
				"nav": true,
				"data": {}
			}
		},
		{
			"collection": "builder-pages",
			"id": "about",
			"data": {
				"id": "about",
				"title": "About",
				"route": "/about",
				"template": "about",
				"draft": false,
				"nav": true,
				"data": {}
			}
		},
		{
			"collection": "builder-pages",
			"id": "contact",
			"data": {
				"id": "contact",
				"title": "Contact",
				"route": "/contact",
				"template": "contact",
				"draft": false,
				"nav": true,
				"data": {}
			}
		},
		{
			"collection": "builder-pages",
			"id": "readme",
			"data": {
				"id": "readme",
				"title": "Getting Started",
				"route": "/readme",
				"template": "readme",
				"draft": false,
				"nav": false,
				"data": {}
			}
		},
		{
			"collection": "builder-pages",
			"id": "not-found",
			"data": {
				"id": "not-found",
				"title": "Page Not Found",
				"route": "/404",
				"template": "404",
				"status": 404,
				"draft": false,
				"nav": false,
				"data": {}
			}
		}
	]
}